{
	"Name": "Shell",
	"Stage": 2,
	"Tier": 1,
	"Variation": "Original",
	"Type": "Normal",
	"Stats": {
		"PhysicalResist": 70,
		"EnergyResist": 60,
		"MaxHealth": 1100000,
		"Grit": 0,
		"Resolve": 0,
		"AttackPhysicalDamage": 0,
		"AttackEnergyDamage": 0,
		"AttackPureDamage": 0,
		"AttackSpeed": 0,
		"AttackDodgeChancePercentage": 0,
		"MoveSpeedSubUnits": 1800,
		"OmegaPowerPercentage": 0,
		"HealthRegeneration": 0,
		"EnergyRegeneration": 0,
		"StartingEnergy": 0,
		"StartingShield": 0,
		"CritChancePercentage": 0,
		"CritAmplificationPercentage": 0,
		"PhysicalVampPercentage": 0,
		"EnergyVampPercentage": 0,
		"PureVampPercentage": 0
	},
	"Abilities": [
		{
			"Name": "Buff Dodge Chance",
			"ActivationTrigger": {
				"TriggerType": "OnBattleStart",
				"Allegiance": "Self"
			},
			"TotalDurationMs": 0,
			"Skills": [
				{
					"Name": "Buff All Stats",
					"Deployment": {
						"Type": "Direct"
					},
					"Targeting": {
						"Type": "Self"
					},
					"EffectPackage": {
						"Effects": [
							{
								"Type": "Buff",
								"Stat": "Grit",
								"OverlapProcessType": "Stacking",
								"Expression": 30000,
								"DurationMs": -1
							},
							{
								"Type": "Buff",
								"Stat": "Resolve",
								"OverlapProcessType": "Stacking",
								"Expression": 30000,
								"DurationMs": -1
							}
						]
					}
				}
			]
		}
	],
	"DisplayName": "Ionic Shell",
	"DisplayDescription": "Health: 1,100\r\nPhysical Resist: 70\r\nEnergy Resist: 60\r\nMovement Speed: 18\r\n\r\nPassive: Gain 30 Grit and Resolve.\r\n\r\nPlasma Shell: Gain 30 Grit and Resolve, and gain 20% damage reduction.",
	"Description": {
		"Format": "Health: {a}\r\nPhysical Resist: {b}\r\nEnergy Resist: {z}\r\nMovement Speed: {c}\r\n\r\nPassive: Gain {d} Grit and Resolve.\r\n\r\nPlasma Shell: Gain 30 Grit and Resolve, and gain 20% damage reduction.",
		"Parameters": {
			"a": {
				"ParameterPath": "Stats.MaxHealth",
				"ValueMultiplier": 0.001
			},
			"b": {
				"ParameterPath": "Stats.PhysicalResist"
			},
			"z": {
				"ParameterPath": "Stats.EnergyResist"
			},
			"c": {
				"ParameterPath": "Stats.MoveSpeedSubUnits",
				"ValueMultiplier": 0.01
			},
			"d": {
				"ParameterPath": "Abilities[0].Skills[0].EffectPackage.Effects[0].Expression",
				"ValueMultiplier": 0.001
			}
		}
	},
	"DisplayDescriptionNormalized": "Health: 1,100\r\nPhysical Resist: 70\r\nEnergy Resist: 60\r\nMovement Speed: 18\r\n\r\nPassive: Gain 30 Grit and Resolve.\r\n\r\nPlasma Shell: Gain 30 Grit and Resolve, and gain 20% damage reduction."
}
