{
	"Name": "Lifewell",
	"Stage": 0,
	"Tier": 0,
	"Variation": "Original",
	"Type": "Normal",
	"Abilities": [
		{
			"Name": "Lifewell_Stats",
			"ActivationTrigger": {
				"TriggerType": "OnBattleStart"
			},
			"TotalDurationMs": 0,
			"Skills": [
				{
					"Name": "Lifewell - List of Stats",
					"Deployment": {
						"Type": "Direct"
					},
					"Targeting": {
						"Type": "Self"
					},
					"EffectPackage": {
						"Effects": [
							{
								"Type": "Buff",
								"Stat": "MaxHealth",
								"OverlapProcessType": "Stacking",
								"DurationMs": -1,
								"Expression": 200000
							},
							{
								"Type": "Buff",
								"Stat": "PhysicalResist",
								"OverlapProcessType": "Stacking",
								"DurationMs": -1,
								"Expression": 15
							},
							{
								"Type": "Buff",
								"Stat": "EnergyResist",
								"OverlapProcessType": "Stacking",
								"DurationMs": -1,
								"Expression": 15
							}
						]
					}
				}
			]
		},
		{
			"Name": "Lifewell_Ability1",
			"ActivationTrigger": {
				"TriggerType": "EveryXTime",
				"ActivateEveryTimeMs": 4000
			},
			"TotalDurationMs": 0,
			"Skills": [
				{
					"Name": "Lifewell - Heal",
					"Deployment": {
						"Type": "Direct"
					},
					"Targeting": {
						"Type": "Self"
					},
					"EffectPackage": {
						"Effects": [
							{
								"Type": "InstantHeal",
								"HealType": "Normal",
								"Expression": {
									"Percentage": 3,
									"Stat": "MaxHealth",
									"StatSource": "Receiver"
								}
							}
						]
					}
				}
			]
		}
	],
	"DisplayName": "Lifewell",
	"DisplayDescription": "The holder heals <MaxHealth>3%</> of <MaxHealth>Max Health</> every 4 seconds.\r\n\r\nStats:\r\n+200 <MaxHealth>Health</>\r\n+15 <Resistance>Resistances</>",
	"Description": {
		"Format": "The holder heals <MaxHealth>{HealVal}%</> of <MaxHealth>Max Health</> every {TriggerTime} seconds.\r\n\r\nStats:\r\n+{Stat_Health} <MaxHealth>Health</>\r\n+{Stat_Resist} <Resistance>Resistances</>",
		"Parameters": {
			"HealVal": {
				"ParameterPath": "Abilities[1].Skills[0].EffectPackage.Effects[0].Expression.Percentage",
				"ValueMultiplier": 1.0
			},
			"TriggerTime": {
				"ParameterPath": "Abilities[1].ActivationTrigger.ActivateEveryTimeMs",
				"ValueMultiplier": 0.001
			},
			"Stat_Health": {
				"ParameterPath": "Abilities[0].Skills[0].EffectPackage.Effects[0].Expression",
				"ValueMultiplier": 0.001
			},
			"Stat_Resist": {
				"ParameterPath": "Abilities[0].Skills[0].EffectPackage.Effects[1].Expression",
				"ValueMultiplier": 1.0
			}
		}
	},
	"DisplayDescriptionNormalized": "The holder heals 3% of Max Health every 4 seconds.\r\n\r\nStats:\r\n+200 Health\r\n+15 Resistances"
}
