{
	"Name": "Phagefire",
	"Stage": 0,
	"Tier": 0,
	"Variation": "Original",
	"Type": "Normal",
	"Abilities": [
		{
			"Name": "Phagefire_Stats",
			"ActivationTrigger": {
				"TriggerType": "OnBattleStart"
			},
			"TotalDurationMs": 0,
			"Skills": [
				{
					"Name": "Phagefire - List of Stats",
					"Deployment": {
						"Type": "Direct"
					},
					"Targeting": {
						"Type": "Self"
					},
					"EffectPackage": {
						"Effects": [
							{
								"Type": "Buff",
								"Stat": "AttackPhysicalDamage",
								"OverlapProcessType": "Stacking",
								"DurationMs": -1,
								"Expression": {
									"Percentage": 10,
									"Stat": "AttackPhysicalDamage",
									"StatSource": "Receiver",
									"StatEvaluationType": "Base"
								}
							},
							{
								"Type": "Buff",
								"Stat": "AttackEnergyDamage",
								"OverlapProcessType": "Stacking",
								"DurationMs": -1,
								"Expression": {
									"Percentage": 10,
									"Stat": "AttackEnergyDamage",
									"StatSource": "Receiver",
									"StatEvaluationType": "Base"
								}
							},
							{
								"Type": "Buff",
								"Stat": "AttackPureDamage",
								"OverlapProcessType": "Stacking",
								"DurationMs": -1,
								"Expression": {
									"Percentage": 10,
									"Stat": "AttackPureDamage",
									"StatSource": "Receiver",
									"StatEvaluationType": "Base"
								}
							},
							{
								"Type": "Buff",
								"Stat": "MaxHealth",
								"OverlapProcessType": "Stacking",
								"DurationMs": -1,
								"Expression": 250000
							},
							{
								"Type": "Buff",
								"Stat": "PhysicalResist",
								"OverlapProcessType": "Stacking",
								"DurationMs": -1,
								"Expression": 10
							},
							{
								"Type": "Buff",
								"Stat": "EnergyResist",
								"OverlapProcessType": "Stacking",
								"DurationMs": -1,
								"Expression": 10
							}
						]
					}
				}
			]
		},
		{
			"Name": "Phagefire_Ability1",
			"ActivationTrigger": {
				"TriggerType": "OnBattleStart"
			},
			"TotalDurationMs": 0,
			"Skills": [
				{
					"Name": "Phagefire_ - Burn",
					"Deployment": {
						"Type": "Direct"
					},
					"Targeting": {
						"Type": "Self"
					},
					"EffectPackage": {
						"Effects": [
							{
								"Type": "Aura",
								"AttachedEffects": [
									{
										"Type": "Debuff",
										"Stat": "HealthGainEfficiencyPercentage",
										"OverlapProcessType": "Sum",
										"DurationMs": -1,
										"RadiusUnits": 20,
										"FrequencyMs": 1000,
										"Expression": 25
									}
								]
							}
						]
					}
				}
			]
		},
		{
			"Name": "Phagefire_Ability2",
			"ActivationTrigger": {
				"TriggerType": "EveryXTime",
				"ActivateEveryTimeMs": 1000
			},
			"TotalDurationMs": 0,
			"Skills": [
				{
					"Name": "Phagefire_ - Poison",
					"Deployment": {
						"Type": "Direct"
					},
					"Targeting": {
						"Type": "InZone",
						"Group": "Enemy",
						"RadiusUnits": 20
					},
					"EffectPackage": {
						"Effects": [
							{
								"Type": "InstantDamage",
								"DamageType": "Pure",
								"Expression": {
									"Percentage": 1,
									"Stat": "MaxHealth",
									"StatSource": "Receiver"
								}
							}
						]
					}
				}
			]
		}
	],
	"DisplayName": "Phagefire",
	"DisplayDescription": "Enemies within 20-hexes are Burned and Poisoned.\r\n\r\nStats:\r\n+10% <AttackDamage>Attack Damage</>\r\n+250 <MaxHealth>Health</>\r\n+10 <Resistance>Resistances</>\r\n\r\n<Italic>Burn: Reduces healing received by 25%.</>\r\n\r\n<Italic>Poison: Deals 1% of target's Max Health as Pure Damage per second.</>",
	"Description": {
		"Format": "Enemies within {Radius}-hexes are Burned and Poisoned.\r\n\r\nStats:\r\n+{Stat_AD}% <AttackDamage>Attack Damage</>\r\n+{Stat_Health} <MaxHealth>Health</>\r\n+{Stat_Resist} <Resistance>Resistances</>\r\n\r\n<Italic>Burn: Reduces healing received by 25%.</>\r\n\r\n<Italic>Poison: Deals 1% of target's Max Health as Pure Damage per second.</>",
		"Parameters": {
			"Radius": {
				"ParameterPath": "Abilities[1].Skills[0].EffectPackage.Effects[0].AttachedEffects[0].RadiusUnits",
				"ValueMultiplier": 1.0
			},
			"Stat_AD": {
				"ParameterPath": "Abilities[0].Skills[0].EffectPackage.Effects[0].Expression.Percentage",
				"ValueMultiplier": 1.0
			},
			"Stat_Health": {
				"ParameterPath": "Abilities[0].Skills[0].EffectPackage.Effects[3].Expression",
				"ValueMultiplier": 0.001
			},
			"Stat_Resist": {
				"ParameterPath": "Abilities[0].Skills[0].EffectPackage.Effects[4].Expression",
				"ValueMultiplier": 1.0
			}
		}
	},
	"DisplayDescriptionNormalized": "Enemies within 20-hexes are Burned and Poisoned.\r\n\r\nStats:\r\n+10% Attack Damage\r\n+250 Health\r\n+10 Resistances\r\n\r\nBurn: Reduces healing received by 25%.\r\n\r\nPoison: Deals 1% of target's Max Health as Pure Damage per second."
}
