{
	"Name": "EssenceSiphon",
	"Stage": 0,
	"Tier": 0,
	"Variation": "Original",
	"Type": "Normal",
	"Abilities": [
		{
			"Name": "EssenceSiphon_Stats",
			"ActivationTrigger": {
				"TriggerType": "OnBattleStart"
			},
			"TotalDurationMs": 0,
			"Skills": [
				{
					"Name": "EssenceSiphon - List of Stats",
					"Deployment": {
						"Type": "Direct"
					},
					"Targeting": {
						"Type": "Self"
					},
					"EffectPackage": {
						"Effects": [
							{
								"Type": "Buff",
								"Stat": "OmegaPowerPercentage",
								"OverlapProcessType": "Stacking",
								"DurationMs": -1,
								"Expression": 20
							},
							{
								"Type": "Buff",
								"Stat": "AttackSpeed",
								"OverlapProcessType": "Stacking",
								"DurationMs": -1,
								"Expression": {
									"Percentage": 5,
									"Stat": "AttackSpeed",
									"StatSource": "Receiver",
									"StatEvaluationType": "Base"
								}
							}
						]
					}
				}
			]
		},
		{
			"Name": "EssenceSiphon_Ability1",
			"ActivationTrigger": {
				"TriggerType": "OnActivateXAbilities",
				"AbilityTypes": [
					"Attack"
				],
				"EveryX": true,
				"NumberOfAbilitiesActivated": 1
			},
			"TotalDurationMs": 0,
			"Skills": [
				{
					"Name": "EssenceSiphon - Gain Energy",
					"Deployment": {
						"Type": "Direct"
					},
					"Targeting": {
						"Type": "Self"
					},
					"EffectPackage": {
						"Effects": [
							{
								"Type": "InstantEnergyGain",
								"Expression": 4000
							}
						]
					}
				}
			]
		}
	],
	"DisplayName": "Essence Siphon",
	"DisplayDescription": "Attacks grant <EnergyCost>4</> bonus <EnergyCost>Energy</>.\r\n\r\nStats:\r\n+20 <OmegaPowerPercentage>Omega Power</>\r\n+5% <AttackSpeed>Attack Speed</>",
	"Description": {
		"Format": "Attacks grant <EnergyCost>{EnergyVal}</> bonus <EnergyCost>Energy</>.\r\n\r\nStats:\r\n+{Stat_OP} <OmegaPowerPercentage>Omega Power</>\r\n+{Stat_AS}% <AttackSpeed>Attack Speed</>",
		"Parameters": {
			"EnergyVal": {
				"ParameterPath": "Abilities[1].Skills[0].EffectPackage.Effects[0].Expression",
				"ValueMultiplier": 0.001
			},
			"Stat_OP": {
				"ParameterPath": "Abilities[0].Skills[0].EffectPackage.Effects[0].Expression"
			},
			"Stat_AS": {
				"ParameterPath": "Abilities[0].Skills[0].EffectPackage.Effects[1].Expression.Percentage"
			}
		}
	},
	"DisplayDescriptionNormalized": "Attacks grant 4 bonus Energy.\r\n\r\nStats:\r\n+20 Omega Power\r\n+5% Attack Speed"
}