{
	"Name": "CriticalSurge",
	"Stage": 0,
	"Tier": 0,
	"Variation": "Original",
	"Type": "Normal",
	"Abilities": [
		{
			"Name": "CriticalSurge_Stats",
			"ActivationTrigger": {
				"TriggerType": "OnBattleStart"
			},
			"TotalDurationMs": 0,
			"Skills": [
				{
					"Name": "CriticalSurge - List of Stats",
					"Deployment": {
						"Type": "Direct"
					},
					"Targeting": {
						"Type": "Self"
					},
					"EffectPackage": {
						"Effects": [
							{
								"Type": "Buff",
								"Stat": "AttackPhysicalDamage",
								"OverlapProcessType": "Stacking",
								"DurationMs": -1,
								"Expression": {
									"Percentage": 10,
									"Stat": "AttackPhysicalDamage",
									"StatSource": "Receiver",
									"StatEvaluationType": "Base"
								}
							},
							{
								"Type": "Buff",
								"Stat": "AttackEnergyDamage",
								"OverlapProcessType": "Stacking",
								"DurationMs": -1,
								"Expression": {
									"Percentage": 10,
									"Stat": "AttackEnergyDamage",
									"StatSource": "Receiver",
									"StatEvaluationType": "Base"
								}
							},
							{
								"Type": "Buff",
								"Stat": "AttackPureDamage",
								"OverlapProcessType": "Stacking",
								"DurationMs": -1,
								"Expression": {
									"Percentage": 10,
									"Stat": "AttackPureDamage",
									"StatSource": "Receiver",
									"StatEvaluationType": "Base"
								}
							},
							{
								"Type": "Buff",
								"Stat": "OmegaPowerPercentage",
								"OverlapProcessType": "Stacking",
								"DurationMs": -1,
								"Expression": 10
							},
							{
								"Type": "Buff",
								"Stat": "CritChancePercentage",
								"OverlapProcessType": "Stacking",
								"DurationMs": -1,
								"Expression": 10
							}
						]
					}
				}
			]
		},
		{
			"Name": "CriticalSurge_Ability1",
			"ActivationTrigger": {
				"TriggerType": "OnDealCrit"
			},
			"TotalDurationMs": 0,
			"Skills": [
				{
					"Name": "CriticalSurge - Gain Omega Power on Crit",
					"Deployment": {
						"Type": "Direct"
					},
					"Targeting": {
						"Type": "Self"
					},
					"EffectPackage": {
						"Effects": [
							{
								"Type": "Buff",
								"Stat": "OmegaPowerPercentage",
								"OverlapProcessType": "Stacking",
								"DurationMs": -1,
								"Expression": 3
							}
						]
					}
				}
			]
		}
	],
	"DisplayName": "Critical Surge",
	"DisplayDescription": "Critical attacks grant <OmegaPowerPercentage>3</> <OmegaPowerPercentage>Omega Power</>.\r\n\r\nStats:\r\n+10% <AttackDamage>Attack Damage</>\r\n+10 <OmegaPowerPercentage>Omega Power</>\r\n+10% <CritChancePercentage>Crit Chance</>",
	"Description": {
		"Format": "Critical attacks grant <OmegaPowerPercentage>{OPValue}</> <OmegaPowerPercentage>Omega Power</>.\r\n\r\nStats:\r\n+{Stat_AD}% <AttackDamage>Attack Damage</>\r\n+{Stat_OP} <OmegaPowerPercentage>Omega Power</>\r\n+{Stat_CC}% <CritChancePercentage>Crit Chance</>",
		"Parameters": {
			"OPValue": {
				"ParameterPath": "Abilities[1].Skills[0].EffectPackage.Effects[0].Expression",
				"ValueMultiplier": 1.0
			},
			"Stat_AD": {
				"ParameterPath": "Abilities[0].Skills[0].EffectPackage.Effects[0].Expression.Percentage",
				"ValueMultiplier": 1.0
			},
			"Stat_OP": {
				"ParameterPath": "Abilities[0].Skills[0].EffectPackage.Effects[3].Expression",
				"ValueMultiplier": 1.0
			},
			"Stat_CC": {
				"ParameterPath": "Abilities[0].Skills[0].EffectPackage.Effects[4].Expression",
				"ValueMultiplier": 1.0
			}
		}
	},
	"DisplayDescriptionNormalized": "Critical attacks grant 3 Omega Power.\r\n\r\nStats:\r\n+10% Attack Damage\r\n+10 Omega Power\r\n+10% Crit Chance"
}
