{
	"Name": "Eldersurge",
	"Stage": 0,
	"Tier": 0,
	"Variation": "Original",
	"Type": "Normal",
	"Abilities": [
		{
			"Name": "Eldersurge_Stats",
			"ActivationTrigger": {
				"TriggerType": "OnBattleStart"
			},
			"TotalDurationMs": 0,
			"Skills": [
				{
					"Name": "Eldersurge - List of Stats",
					"Deployment": {
						"Type": "Direct"
					},
					"Targeting": {
						"Type": "Self"
					},
					"EffectPackage": {
						"Effects": [
							{
								"Type": "Buff",
								"Stat": "MaxHealth",
								"OverlapProcessType": "Stacking",
								"DurationMs": -1,
								"Expression": 100000
							},
							{
								"Type": "Buff",
								"Stat": "OmegaPowerPercentage",
								"OverlapProcessType": "Stacking",
								"DurationMs": -1,
								"Expression": 10
							}
						]
					}
				}
			]
		},
		{
			"Name": "Eldersurge_Ability1",
			"ActivationTrigger": {
				"TriggerType": "OnBattleStart"
			},
			"TotalDurationMs": 0,
			"Skills": [
				{
					"Name": "Eldersurge - Ally Heal Efficiency",
					"Deployment": {
						"Type": "Direct",
						"Guidance": [
							"Ground",
							"Underground",
							"Airborne"
						]
					},
					"Targeting": {
						"Type": "Allegiance",
						"Guidance": [
							"Ground",
							"Underground",
							"Airborne"
						],
						"Group": "Ally",
						"Self": false
					},
					"EffectPackage": {
						"Effects": [
							{
								"Type": "Buff",
								"Stat": "HealthGainEfficiencyPercentage",
								"OverlapProcessType": "Sum",
								"DurationMs": -1,
								"Expression": 25
							}
						]
					}
				}
			]
		},
		{
			"Name": "Eldersurge_Ability2",
			"ActivationTrigger": {
				"TriggerType": "EveryXTime",
				"ActivateEveryTimeMs": 10000,
				"MaxActivations": 1
			},
			"TotalDurationMs": 0,
			"Skills": [
				{
					"Name": "Eldersurge - Self Heal Efficiency",
					"Deployment": {
						"Type": "Direct"
					},
					"Targeting": {
						"Type": "Self"
					},
					"EffectPackage": {
						"Effects": [
							{
								"Type": "Buff",
								"Stat": "HealthGainEfficiencyPercentage",
								"OverlapProcessType": "Sum",
								"DurationMs": -1,
								"Expression": 50
							}
						]
					}
				}
			]
		}
	],
	"DisplayName": "Eldersurge",
	"DisplayDescription": "Combat Start: Holder's allies receive <HealthGainEfficiencyPercentage>25%</> more <HealthGainEfficiencyPercentage>Healing</>.\r\n\r\nAfter 10 seconds, the holder gains double the amount.\r\n\r\nStats:\r\n+100 <MaxHealth>Health</>\r\n+10 <OmegaPowerPercentage>Omega Power</>",
	"Description": {
		"Format": "Combat Start: Holder's allies receive <HealthGainEfficiencyPercentage>{HealEffAlly}%</> more <HealthGainEfficiencyPercentage>Healing</>.\r\n\r\nAfter {TriggerTime} seconds, the holder gains double the amount.\r\n\r\nStats:\r\n+{Stat_Health} <MaxHealth>Health</>\r\n+{Stat_OP} <OmegaPowerPercentage>Omega Power</>",
		"Parameters": {
			"HealEffAlly": {
				"ParameterPath": "Abilities[1].Skills[0].EffectPackage.Effects[0].Expression",
				"ValueMultiplier": 1.0
			},
			"TriggerTime": {
				"ParameterPath": "Abilities[2].ActivationTrigger.ActivateEveryTimeMs",
				"ValueMultiplier": 0.001
			},
			"Stat_Health": {
				"ParameterPath": "Abilities[0].Skills[0].EffectPackage.Effects[0].Expression",
				"ValueMultiplier": 0.001
			},
			"Stat_OP": {
				"ParameterPath": "Abilities[0].Skills[0].EffectPackage.Effects[1].Expression",
				"ValueMultiplier": 1.0
			}
		}
	},
	"DisplayDescriptionNormalized": "Combat Start: Holder's allies receive 25% more Healing.\r\n\r\nAfter 10 seconds, the holder gains double the amount.\r\n\r\nStats:\r\n+100 Health\r\n+10 Omega Power"
}
